item_type,date_uploaded,source_file,dcterms:title,dcterms:created,dcterms:description,dcterms:contributor,dcterms:identifier:controlNumber,mods:locationUrl,mods:mediaType,mods:physicalExtent,mods:physicalForm,dcterms:subject,dcterms:language,mods:accessCondition,dcterms:rights
Item,2024-12-21,../collection-data/item-metadata/cn_97518651.json,"[Casey Stengel, full-length portrait, wearing sunglasses, while playing outfield for the Brooklyn Dodgers]",1915,"Title devised by Library staff. George Grantham Bain Collection (Library of Congress). General information about the Bain Collection is available at http://hdl.loc.gov/loc.pnp/pp.ggbain Published in: Baseball Americana : treasures from the Library of Congress / Harry Katz, et al. New York : Smithsonian Books, 2009.",,97518651,//www.loc.gov/pictures/item/97518651/,image/gif|image/jpg|image/tif|image/jpeg,1 photographic print.,,"Stengel, Casey|Baseball players--New York (State)--New York--1910-1920",english,No known restrictions on publication.,"Copyright and Other Restrictions The Library of Congress is providing access to these materials for educational and research purposes. The written permission of the copyright owners and/or other rights holders (such as publicity and/or privacy rights) is required for distribution, reproduction, or other use of protected items beyond that allowed by fair use or other statutory exemptions. While the Library is unaware of any U.S. copyright protection (see Title 17, U.S.C.) or any other restrictions on the materials reproduced in the By Popular Demand: Jackie Robinson and Other Baseball Highlights 1860s-1960s (except where indicated in the information that accompanies certain items), there may be content protected by copyright or neighboring-rights laws of other nations. Additionally there may be restrictions placed by donors on the use of materials. Responsibility for making an independent legal assessment of an item and securing any necessary permissions ultimately rests with persons desiring to use the item. Users should consult the catalog information that accompanies each item for specific information. This catalog data provides the details known by the Library of Congress regarding the corresponding item and may assist users in making independent assessments of the legal status of these items as related to their desired uses. Users should also consult restrictions associated with donations to the Library. Some of the restrictions for items in this online collection are described below. Some of the materials included in the By Popular Demand: Jackie Robinson and Other Baseball Highlights, 1860s-1960s, were given to the Library of Congress subject to certain conditions. The Library obtained permission to use any materials included in this presentation that are subject to such conditions. Contact the appropriate custodial division of the Library of Congress for more information about such possible restrictions. Credit line: Library of Congress, [Name of the appropriate custodial division within the Library], Reproduction number (e.g., LC-USZC4-6142) Contact the Prints & Photographs Division for further information about materials from these collections. Look Magazine Photograph Collection. Reproduction of material is ""not for trade or advertising purposes."" Visual Materials from the NAACP Records. Contact the Manuscript Division for further information about materials from these collections. Arthur Mann Papers, Literary rights are reserved to the heirs of Mrs. Marion Mann until January 2017. Branch Rickey Papers, Literary rights reserved to heirs of Branch Rickey. Lawrence E. Spivak Papers."
Item,2024-12-21,../collection-data/item-metadata/cn_2001696483.json,"[Katharine Wright, wearing a leather jacket, cap, and goggles, aboard the Wright Model HS airplane with Orville, 1915]",1915,"Title based on: Wilbur & Orville Wright, pictorial materials: a documentary guide / Arthur G. Renstrom. Washington: Library of Congress, 1982, p. 44. Attributed to Wilbur and/or Orville Wright. Reference copy in LOT 11512. Forms part of: Glass negatives from the Papers of Wilbur and Orville Wright.","Wright, Wilbur, 1867-1912, photographer|Wright, Orville, 1871-1948, photographer",2001696483,//www.loc.gov/pictures/item/2001696483/,image/gif|image/jpg|image/tif,1 negative|4 x 5 in.,"glass, dry plate","Haskell, Katharine Wright,--1874-1929--Family|Wright, Orville,--1871-1948--Family|Airplanes--1910-1920",english,No known restrictions.,"The Library of Congress does not own rights to material in its collections. Therefore, it does not license or charge permission fees for use of such material and cannot grant or deny permission to publish or otherwise distribute the material. Ultimately, it is the researcher's obligation to assess copyright or other use restrictions and obtain permission from third parties when necessary before publishing or otherwise distributing materials found in the Library's collections. For information about reproducing, publishing, and citing material from this collection, as well as access to the original items, see: Wright Brothers Photographs - Rights and Restrictions Information"
Item,2024-12-21,../collection-data/item-metadata/cn_2017696833.json,"The latest in eye shields--for desert warfare. A shortage of non-inflammable celluloid has prompted the Union of South Africa government to utilize old photographic negatives to make eye shields needed for use in desert warfare. The original images in the shield can be seen by turning the picture upside down. The emulsion is washed off the negatives to make the shields transparent. More than a million such shields have been produced to protect United Nations soldier's eyes from wind, sand and dust. Margaret Bucci of Washington, D.C., demonstrated the shield",1943-03,"Actual size of negative is C (approximately 4 x 5 inches). File print missing series code; added Aug. 1999. Title and other information from caption card. Transfer; United States. Office of War Information. Overseas Picture Division. Washington Division; 1944. More information about the FSA/OWI Collection is available at http://hdl.loc.gov/loc.pnp/pp.fsaowi Film copy on SIS roll 32, frame 1346.",United States. Office of War Information.,2017696833,//www.loc.gov/pictures/item/2017696833/,image/gif|image/jpg|image/tif,1 negative|4 x 5 inches or smaller.,safety,United States--District of Columbia--Washington (D.C.),english,,"The contents of the Library of Congress Farm Security Administration/Office of War Information Black-and-White Negatives are in the public domain and are free to use and reuse. Credit Line: Library of Congress, Prints & Photographs Division, Farm Security Administration/Office of War Information Black-and-White Negatives. For information about reproducing, publishing, and citing material from this collection, as well as access to the original items, see: U.S. Farm Security Administration/Office of War Information Black & White Photographs - Rights and Restrictions Information More about Copyright and other Restrictions For guidance about compiling full citations consult Citing Primary Sources ."
Item,2024-12-21,../collection-data/item-metadata/cn_2013648190.json,"[Theodore Roosevelt, head-and-shoulders portrait, facing front]",1918,"Photograph showing Theodore Roosevelt, .","Baker's Art Gallery, copyright claimant",2013648190,https://www.loc.gov/pictures/item/2013648190/,image/gif|image/jpg|image/tif,1 photographic print.,,"Roosevelt, Theodore,--1858-1919",english,No known restrictions on publication.,See Access Condition or item source for rights information.
Item,2024-12-21,../collection-data/item-metadata/cn_2017798280.json,"Ensenada, Puerto Rico. Laborer wearing goggles as protection against the fumes and vapors of hot molasses at the South Puerto Rico Sugar Company",1942-01,"Title and other information from caption card. Transfer; United States. Office of War Information. Overseas Picture Division. Washington Division; 1944. More information about the FSA/OWI Collection is available at http://hdl.loc.gov/loc.pnp/pp.fsaowi Temp. note: usf34batch5 Film copy on SIS roll 5, frame 120.","Delano, Jack, 1914-1997, photographer",2017798280,https://www.loc.gov/pictures/item/2017798280/,image/gif|image/jpg|image/tif,1 negative|3 1/4 x 4 1/4 inches or smaller.,safety,United States--Puerto Rico--Ponce Municipality--Ensenada,english,"No known restrictions. For information, see U.S. Farm Security Administration/Office of War Information Black & White Photographs https://www.loc.gov/rr/print/res/071_fsab.html","The contents of the Library of Congress Farm Security Administration/Office of War Information Black-and-White Negatives are in the public domain and are free to use and reuse. Credit Line: Library of Congress, Prints & Photographs Division, Farm Security Administration/Office of War Information Black-and-White Negatives. For information about reproducing, publishing, and citing material from this collection, as well as access to the original items, see: U.S. Farm Security Administration/Office of War Information Black & White Photographs - Rights and Restrictions Information More about Copyright and other Restrictions For guidance about compiling full citations consult Citing Primary Sources ."
Item,2024-12-21,../collection-data/item-metadata/cn_None.json,"Benjamin Franklin Papers: Series II, 1726-1818; 1784, Jan. 12-1785, May 23 (vol. 22)",,,"Franklin, Benjamin, 1706-1790",,,image/gif|image/tiff|image/jpeg|image/jp2,,,"United States--History--Revolution, 1775-1783|Great Britain--Foreign relations--United States|United States--Foreign relations--Great Britain|Diplomatic and consular service, American--France|United States--Foreign relations--France|Diplomats|Great Britain. Treaties, etc. United States, 1783 September 3|United States--Foreign relations--1775-1783|United States--History--Revolution, 1775-1783--Peace|Scientists|Manuscripts|United States",english,,"The Library of Congress's digital scans of the papers of Benjamin Franklin are in the public domain. Credit Line: Library of Congress, Manuscript Division, Benjamin Franklin Papers. More about Copyright and other Restrictions . For guidance about compiling full citations consult Citing Primary Sources ."
